{
  "schema_name": "segment_diagnostics",
  "schema_version": "1.0.0",
  "artifact_id": "art_segment_diagnostics_example",
  "project_id": "prj_demo",
  "revision_id": "rev_001",
  "segment_id": "segment_000001",
  "created_at": "2026-07-24T12:00:00Z",
  "producer": {
    "application_version": "0.2.0",
    "stage": "segment-review",
    "adapter": "fixture",
    "adapter_version": "1"
  },
  "planning_key": "aaaaaaaaaaaaaaaaaaaaaaaaaaaaaaaaaaaaaaaaaaaaaaaaaaaaaaaaaaaaaaaa",
  "preview_sha256": "2222222222222222222222222222222222222222222222222222222222222222",
  "mask_matte": [],
  "warnings": ["no_mask_or_matte_diagnostics"],
  "status": "warning"
}
